<?xml version="1.0" encoding="utf-8"?>
<!DOCTYPE list SYSTEM "tree.dtd">
<!--Create by VISTALL. Full reworked to Glory of Destruction by Bonux. -->
<list>
	<awake_parent_skill_tree>
		<awake_class id="140">	<!--Воин Тира-->
			<parent_class id="88"> <!--Дуэлист-->
				<skill id="87" level="1" name="Найти Уязвимость Животных"/>
				<skill id="104" level="1" name="Найти Уязвимость Растений"/>
				<skill id="80" level="1" name="Найти Уязвимость Чудовищ"/>
				<skill id="88" level="1" name="Найти Уязвимость Драконов"/>
				<skill id="451" level="2" name="Звуковое Движение"/>
				<skill id="297" level="2" name="Дух Дуэлянта"/>
				<skill id="5" level="31" name="Двойной Звуковой Разрез"/>
				<skill id="144" level="37" name="Владение Парным Оружием"/>
				<skill id="227" level="50" name="Владение Легкой Броней"/>
				<skill id="9" level="34" name="Звуковая Волна"/>
				<skill id="7" level="33" name="Звуковой Шторм(Sonic Storm)"/>
				<skill id="257" level="45" name="Владение Мечом/Дробящим Оружием"/>
				<skill id="261" level="27" name="Тройное Звуковое Рассечение(Triple Sonic Slash)"/>
				<skill id="1" level="37" name="Тройное Рассечение"/>
				<skill id="290" level="14" name="Предельное Безумие"/>
				<skill id="212" level="8" name="Быстрое Восстановление HP"/>
				<skill id="190" level="37" name="Фатальный Удар"/>
				<skill id="260" level="37" name="Сокрушение Молотом"/>
				<skill id="231" level="50" name="Владение Тяжелой Броней"/>
				<skill id="328" level="1" name="Мудрость"/>
				<skill id="329" level="1" name="Здоровье"/>
				<skill id="330" level="1" name="Владение Умениями"/>
				<skill id="359" level="1" name="Глаз Охотника"/>
				<skill id="345" level="4" name="Гнев Звука"/>
				<skill id="360" level="1" name="Глаз Убийцы"/>
				<skill id="992" level="8" name="Владение Звуком"/>
				<skill id="442" level="1" name="Звуковой Барьер"/>
				<skill id="8" level="8" name="Фокусировка Звука"/>
				<skill id="775" level="1" name="Блокировка Оружия"/>
				<skill id="995" level="1" name="Стремительный Натиск"/>
				<skill id="430" level="4" name="Мастер Схватки"/>
			</parent_class>
			<parent_class id="89"> <!--Полководец-->
				<skill id="87" level="1" name="Найти Уязвимость Животных"/>
				<skill id="104" level="1" name="Найти Уязвимость Растений"/>
				<skill id="80" level="1" name="Найти Уязвимость Чудовищ"/>
				<skill id="181" level="1" name="Возрождение"/>
				<skill id="130" level="2" name="Волнующая Схватка"/>
				<skill id="88" level="1" name="Найти Уязвимость Драконов"/>
				<skill id="286" level="8" name="Провоцировать"/>
				<skill id="121" level="6" name="Боевой Рев"/>
				<skill id="452" level="5" name="Оглушающий Топот"/>
				<skill id="227" level="50" name="Владение Легкой Броней"/>
				<skill id="211" level="10" name="Увеличение HP"/>
				<skill id="36" level="37" name="Вихрь"/>
				<skill id="48" level="42" name="Грозовой Шторм"/>
				<skill id="421" level="5" name="Свирепое Нападение"/>
				<skill id="920" level="37" name="Сокрушительная Мощь"/>
				<skill id="290" level="14" name="Предельное Безумие"/>
				<skill id="212" level="8" name="Быстрое Восстановление HP"/>
				<skill id="317" level="5" name="Фокусировка Атаки"/>
				<skill id="216" level="45" name="Владение Древковым Оружием"/>
				<skill id="422" level="3" name="Точность Копья"/>
				<skill id="116" level="14" name="Вой"/>
				<skill id="231" level="50" name="Владение Тяжелой Броней"/>
				<skill id="921" level="1" name="Острие Иглы"/>
				<skill id="328" level="1" name="Мудрость"/>
				<skill id="329" level="1" name="Здоровье"/>
				<skill id="330" level="1" name="Владение Умениями"/>
				<skill id="359" level="1" name="Глаз Охотника"/>
				<skill id="360" level="1" name="Глаз Убийцы"/>
				<skill id="347" level="1" name="Землетрясение"/>
				<skill id="995" level="1" name="Стремительный Натиск"/>
				<skill id="320" level="10" name="Гнев"/>
			</parent_class>
			<parent_class id="113"> <!--Титан--><!--Checked offlike: 04.02.2016-->
				<skill id="176" level="5" name="Безумие"/>
				<skill id="34" level="3" name="Перевязка"/>
				<skill id="121" level="6" name="Боевой Рев"/>
				<skill id="148" level="8" name="Жизненная Сила"/>
				<skill id="227" level="50" name="Владение Легкой Броней"/>
				<skill id="211" level="10" name="Увеличение HP"/>
				<skill id="257" level="45" name="Владение Мечом/Дробящим Оружием"/>
				<skill id="36" level="37" name="Вихрь"/>
				<skill id="423" level="3" name="Инфернальный Вид"/>
				<skill id="315" level="16" name="Сокрушение Судьбы"/>
				<skill id="293" level="20" name="Владение Двуручным Оружием"/>
				<skill id="212" level="8" name="Быстрое Восстановление HP"/>
				<skill id="190" level="37" name="Фатальный Удар"/>
				<skill id="216" level="45" name="Владение Древковым Оружием"/>
				<skill id="422" level="3" name="Точность Копья"/>
				<skill id="260" level="37" name="Сокрушение Молотом"/>
				<skill id="231" level="50" name="Владение Тяжелой Броней"/>
				<skill id="328" level="1" name="Мудрость"/>
				<skill id="335" level="1" name="Стойкость"/>
				<skill id="329" level="1" name="Здоровье"/>
				<skill id="330" level="1" name="Владение Умениями"/>
				<skill id="362" level="1" name="Пролом Брони"/>
				<skill id="347" level="1" name="Землетрясение"/>
				<skill id="995" level="1" name="Стремительный Натиск"/>
				<skill id="139" level="5" name="Мужество"/>
				<skill id="94" level="4" name="Гнев"/>
			</parent_class>
			<parent_class id="114"> <!--Аватар-->
				<skill id="319" level="2" name="Быстрое Перемещение"/>
				<skill id="282" level="1" name="Тотемный Дух Пумы"/>
				<skill id="109" level="1" name="Тотемный Дух Огра"/>
				<skill id="168" level="3" name="Увеличить Скорость Атаки"/>
				<skill id="298" level="1" name="Тотемный Дух Кролика"/>
				<skill id="292" level="1" name="Тотемный Дух Бизона"/>
				<skill id="81" level="3" name="Удар Судьбы"/>
				<skill id="233" level="47" name="Владение Легкой Броней"/>
				<skill id="280" level="37" name="Горящий Кулак"/>
				<skill id="281" level="37" name="Разрушитель Душ"/>
				<skill id="423" level="3" name="Инфернальный Вид"/>
				<skill id="95" level="20" name="Хромота"/>
				<skill id="425" level="1" name="Тотемный Дух Ястреба"/>
				<skill id="17" level="34" name="Взрыв Силы"/>
				<skill id="35" level="33" name="Силовой Шторм"/>
				<skill id="210" level="45" name="Владение Кастетами"/>
				<skill id="284" level="40" name="Ураганное Нападение"/>
				<skill id="328" level="1" name="Мудрость"/>
				<skill id="329" level="1" name="Здоровье"/>
				<skill id="330" level="1" name="Владение Умениями"/>
				<skill id="346" level="4" name="Гнев Силы"/>
				<skill id="441" level="1" name="Силовая Медитация"/>
				<skill id="993" level="8" name="Владение Силой"/>
				<skill id="443" level="1" name="Силовой Барьер"/>
				<skill id="50" level="8" name="Фокусировка Силы"/>
				<skill id="995" level="1" name="Стремительный Натиск"/>
				<skill id="222" level="3" name="Ярость Орка"/>
			</parent_class>
			<parent_class id="118"> <!--Мастер-->
				<skill id="822" level="3" name="Починка Голема"/>
				<skill id="824" level="3" name="Бронепластина"/>
				<skill id="823" level="3" name="Усиление Голема"/>
				<skill id="34" level="3" name="Перевязка"/>
				<skill id="1561" level="5" name="Боевой Клич"/>
				<skill id="248" level="5" name="Кристаллизация"/>
				<skill id="172" level="10" name="Создать Вещь"/>
				<skill id="148" level="8" name="Жизненная Сила"/>
				<skill id="25" level="9" name="Призвать Механического Голема"/>
				<skill id="227" level="50" name="Владение Легкой Броней"/>
				<skill id="211" level="10" name="Увеличение HP"/>
				<skill id="301" level="5" name="Призвать Гулкий Рокот"/>
				<skill id="205" level="45" name="Владение Мечом/Дробящим Оружием"/>
				<skill id="36" level="37" name="Вихрь"/>
				<skill id="212" level="8" name="Быстрое Восстановление HP"/>
				<skill id="190" level="37" name="Фатальный Удар"/>
				<skill id="216" level="45" name="Владение Древковым Оружием"/>
				<skill id="422" level="3" name="Точность Копья"/>
				<skill id="260" level="37" name="Сокрушение Молотом"/>
				<skill id="231" level="50" name="Владение Тяжелой Броней"/>
				<skill id="328" level="1" name="Мудрость"/>
				<skill id="329" level="1" name="Здоровье"/>
				<skill id="330" level="1" name="Владение Умениями"/>
				<skill id="362" level="1" name="Пролом Брони"/>
				<skill id="347" level="1" name="Землетрясение"/>
				<skill id="995" level="1" name="Стремительный Натиск"/>
			</parent_class>
			<parent_class id="131"> <!--Каратель-->
				<skill id="481" level="2" name="Броня Тьмы"/>
				<skill id="832" level="1" name="Быстрое Восстановление"/>
				<skill id="833" level="1" name="Восстановление Тела"/>
				<skill id="1514" level="3" name="Преграда Душ"/>
				<skill id="20006" level="1" name="Рев Душ"/>
				<skill id="503" level="3" name="Презрение"/>
				<skill id="1510" level="1" name="Искупление Души"/>
				<skill id="477" level="37" name="Сокрушение Тьмой"/>
				<skill id="465" level="50" name="Владение Легкой Броней"/>
				<skill id="501" level="12" name="Дурной Характер"/>
				<skill id="496" level="31" name="Режущий Клинок"/>
				<skill id="492" level="25" name="Расправить Крылья"/>
				<skill id="472" level="45" name="Владение Древним Мечом"/>
				<skill id="498" level="12" name="Инфекция"/>
				<skill id="497" level="16" name="Сокрушающая Боль"/>
				<skill id="328" level="1" name="Мудрость"/>
				<skill id="329" level="1" name="Здоровье"/>
				<skill id="330" level="1" name="Владение Умениями"/>
				<skill id="793" level="1" name="Стремительный Натиск"/>
				<skill id="939" level="1" name="Гнев Души"/>
				<skill id="526" level="1" name="Энума Элиш"/>
				<skill id="794" level="1" name="Массовое Разоружение"/>
				<skill id="483" level="4" name="Защититься Мечом"/>
				<skill id="485" level="12" name="Разоружить"/>
			</parent_class>
		</awake_class>
	</awake_parent_skill_tree>
</list>