<?xml version="1.0" encoding="utf-8"?>
<!DOCTYPE list SYSTEM "tree.dtd">
<!--AUTHOR: Bonux-->
<list>
	<normal_skill_tree>
		<class id="185">	<!--Последователь Сайхи-->
			<!--Default by level skills-->
			<skill id="30004" level="1" name="Водяной Удар(Hydro Strike)" cost="45" min_level="40"/>
			<skill id="17920" level="1" name="Зелье Исцеления Ветра(Windy Healing Potion)" min_level="40"/>
			<skill id="30017" level="1" name="Идеальный Шторм(Squall)" cost="45" min_level="40"/>
			<skill id="30012" level="1" name="Натиск Ветра(Air Rush)" cost="45" min_level="40"/>
			<skill id="30016" level="1" name="Око Шторма(Eye of the Storm)" cost="45" min_level="40"/>
			<skill id="17943" level="1" name="Перегонный Куб(Alchemy Cube)" min_level="40"/>
			<skill id="30042" level="2" name="Превосходная Перезарядка(Eminent Quick Recovery)" cost="45" min_level="40"/>
			<skill id="30040" level="3" name="Превосходное Владение Дробящим Оружием(Eminent Blunt Weapon Mastery)" cost="45" min_level="40"/>
			<skill id="30041" level="3" name="Превосходное Владение Магической Броней(Eminent Robe Mastery)" cost="45" min_level="40"/>
			<skill id="30045" level="1" name="Превосходные Способности(Eminent Ability)" cost="45" min_level="40"/>
			<skill id="30001" level="5" name="Водная Атака(Hydro Attack)" cost="51" min_level="42"/>
			<skill id="30004" level="2" name="Водяной Удар(Hydro Strike)" cost="56" min_level="44"/>
			<skill id="30012" level="2" name="Натиск Ветра(Air Rush)" cost="56" min_level="44"/>
			<skill id="30001" level="6" name="Водная Атака(Hydro Attack)" cost="78" min_level="46"/>
			<skill id="30004" level="3" name="Водяной Удар(Hydro Strike)" cost="101" min_level="48"/>
			<skill id="30012" level="3" name="Натиск Ветра(Air Rush)" cost="101" min_level="48"/>
			<skill id="30001" level="7" name="Водная Атака(Hydro Attack)" cost="123" min_level="50"/>
			<skill id="1405" level="1" name="Божественное Вдохновение(Divine Inspiration)" cost="144" min_level="52"/>
			<skill id="30004" level="4" name="Водяной Удар(Hydro Strike)" cost="144" min_level="52"/>
			<skill id="30012" level="4" name="Натиск Ветра(Air Rush)" cost="144" min_level="52"/>
			<skill id="30040" level="4" name="Превосходное Владение Дробящим Оружием(Eminent Blunt Weapon Mastery)" cost="144" min_level="52"/>
			<skill id="30041" level="4" name="Превосходное Владение Магической Броней(Eminent Robe Mastery)" cost="144" min_level="52"/>
			<skill id="30001" level="8" name="Водная Атака(Hydro Attack)" cost="152" min_level="54"/>
			<skill id="30004" level="5" name="Водяной Удар(Hydro Strike)" cost="158" min_level="56"/>
			<skill id="30012" level="5" name="Натиск Ветра(Air Rush)" cost="158" min_level="56"/>
			<skill id="30004" level="6" name="Водяной Удар(Hydro Strike)" cost="227" min_level="58"/>
			<skill id="30012" level="6" name="Натиск Ветра(Air Rush)" cost="227" min_level="58"/>
			<skill id="30004" level="6" name="Водяной Удар(Hydro Strike)" cost="227" min_level="60"/>
			<skill id="30012" level="6" name="Натиск Ветра(Air Rush)" cost="227" min_level="60"/>
			<skill id="1405" level="2" name="Божественное Вдохновение(Divine Inspiration)" cost="294" min_level="61"/>
			<skill id="30001" level="10" name="Водная Атака(Hydro Attack)" cost="301" min_level="62"/>
			<skill id="30003" level="2" name="Ледяная Вспышка(Hydro Flare)" cost="301" min_level="62"/>
			<skill id="30004" level="7" name="Водяной Удар(Hydro Strike)" cost="315" min_level="64"/>
			<skill id="30012" level="7" name="Натиск Ветра(Air Rush)" cost="315" min_level="64"/>
			<skill id="30040" level="5" name="Превосходное Владение Дробящим Оружием(Eminent Blunt Weapon Mastery)" cost="315" min_level="64"/>
			<skill id="30041" level="5" name="Превосходное Владение Магической Броней(Eminent Robe Mastery)" cost="315" min_level="64"/>
			<skill id="30001" level="11" name="Водная Атака(Hydro Attack)" cost="515" min_level="66"/>
			<skill id="30003" level="3" name="Ледяная Вспышка(Hydro Flare)" cost="515" min_level="66"/>
			<skill id="30004" level="8" name="Водяной Удар(Hydro Strike)" cost="717" min_level="68"/>
			<skill id="30012" level="8" name="Натиск Ветра(Air Rush)" cost="717" min_level="68"/>
			<skill id="30001" level="12" name="Водная Атака(Hydro Attack)" cost="919" min_level="70"/>
			<skill id="30003" level="4" name="Ледяная Вспышка(Hydro Flare)" cost="919" min_level="70"/>
			<skill id="30004" level="9" name="Водяной Удар(Hydro Strike)" cost="1122" min_level="72"/>
			<skill id="30012" level="9" name="Натиск Ветра(Air Rush)" cost="1122" min_level="72"/>
			<skill id="30001" level="13" name="Водная Атака(Hydro Attack)" cost="1686" min_level="74"/>
			<skill id="30003" level="5" name="Ледяная Вспышка(Hydro Flare)" cost="1686" min_level="74"/>
		</class>
	</normal_skill_tree>
</list>