<?xml version="1.0" encoding="utf-8"?>
<!DOCTYPE list SYSTEM "tree.dtd">
<!--AUTHOR: Bonux-->
<list>
	<normal_skill_tree>
		<class id="186">	<!--Ловец Ветра-->
			<!--Default by level skills-->
			<skill id="1405" level="3" name="Божественное Вдохновение(Divine Inspiration)" cost="3000" min_level="76"/>
			<skill id="1405" level="4" name="Божественное Вдохновение(Divine Inspiration)" cost="3000" min_level="76"/>
			<skill id="30504" level="1" name="Встречный Ветер Гравитации(Gravity Hit)" cost="3000" min_level="76"/>
			<skill id="30530" level="1" name="Искажение Энергии(Crushing Air)" cost="3000" min_level="76"/>
			<skill id="30542" level="3" name="Превосходная Устойчивость(Eminent Stability)" cost="3000" min_level="76"/>
			<skill id="30540" level="6" name="Превосходное Владение Кастетами(Eminent Fist Weapon Mastery)" cost="3000" min_level="76"/>
			<skill id="30541" level="6" name="Превосходное Владение Легкими Доспехами(Eminent Light Armor Mastery)" cost="3000" min_level="76"/>
			<skill id="30544" level="1" name="Превосходное Сопротивление Отрицательным Эффектам(Eminent Trait Resistance)" cost="3000" min_level="76"/>
			<skill id="30543" level="1" name="Превосходное Сопротивление Стихиям(Eminent Attribute Resistance)" cost="3000" min_level="76"/>
			<skill id="30545" level="2" name="Превосходные Способности(Eminent Ability)" cost="3000" min_level="76"/>
			<skill id="30512" level="1" name="Преображение(Distortion)" cost="3000" min_level="76"/>
			<skill id="30526" level="1" name="Удар Гравитации(Heavy Punch)" cost="3000" min_level="76"/>
			<skill id="30502" level="10" name="Удар с Рассечением(Chin Strike)" cost="3000" min_level="76"/>
			<skill id="30507" level="10" name="Шаг Влево(Left Sidestep)" cost="3000" min_level="76"/>
			<skill id="30509" level="1" name="Шаг Назад(Back Step)" cost="3000" min_level="76"/>
			<skill id="30500" level="14" name="Боковая Атака(Lateral Hit)" cost="4500" min_level="77"/>
			<skill id="30501" level="13" name="Удар с Разворота(Backspin Blow)" cost="4500" min_level="77"/>
			<skill id="30508" level="13" name="Шаг Вправо(Right Sidestep)" cost="4500" min_level="77"/>
			<skill id="30504" level="2" name="Встречный Ветер Гравитации(Gravity Hit)" cost="6000" min_level="78"/>
			<skill id="30530" level="2" name="Искажение Энергии(Crushing Air)" cost="6000" min_level="78"/>
			<skill id="30502" level="11" name="Удар с Рассечением(Chin Strike)" cost="6000" min_level="78"/>
			<skill id="30507" level="11" name="Шаг Влево(Left Sidestep)" cost="6000" min_level="78"/>
			<skill id="30500" level="15" name="Боковая Атака(Lateral Hit)" cost="7500" min_level="79"/>
			<skill id="30506" level="1" name="Удар Ногой в Голову с Разворота(Distant Kick)" cost="7500" min_level="79"/>
			<skill id="30501" level="14" name="Удар с Разворота(Backspin Blow)" cost="7500" min_level="79"/>
			<skill id="30508" level="14" name="Шаг Вправо(Right Sidestep)" cost="7500" min_level="79"/>
			<skill id="30504" level="3" name="Встречный Ветер Гравитации(Gravity Hit)" cost="9000" min_level="80"/>
			<skill id="30530" level="3" name="Искажение Энергии(Crushing Air)" cost="9000" min_level="80"/>
			<skill id="30540" level="7" name="Превосходное Владение Кастетами(Eminent Fist Weapon Mastery)" cost="9000" min_level="80"/>
			<skill id="30541" level="7" name="Превосходное Владение Легкими Доспехами(Eminent Light Armor Mastery)" cost="9000" min_level="80"/>
			<skill id="30502" level="12" name="Удар с Рассечением(Chin Strike)" cost="9000" min_level="80"/>
			<skill id="30507" level="12" name="Шаг Влево(Left Sidestep)" cost="9000" min_level="80"/>
			<skill id="30500" level="16" name="Боковая Атака(Lateral Hit)" cost="10500" min_level="81"/>
			<skill id="30506" level="2" name="Удар Ногой в Голову с Разворота(Distant Kick)" cost="10500" min_level="81"/>
			<skill id="30501" level="15" name="Удар с Разворота(Backspin Blow)" cost="10500" min_level="81"/>
			<skill id="30508" level="15" name="Шаг Вправо(Right Sidestep)" cost="10500" min_level="81"/>
			<skill id="30504" level="4" name="Встречный Ветер Гравитации(Gravity Hit)" cost="12000" min_level="82"/>
			<skill id="30530" level="4" name="Искажение Энергии(Crushing Air)" cost="12000" min_level="82"/>
			<skill id="30502" level="13" name="Удар с Рассечением(Chin Strike)" cost="12000" min_level="82"/>
			<skill id="30507" level="13" name="Шаг Влево(Left Sidestep)" cost="12000" min_level="82"/>
			<skill id="30500" level="17" name="Боковая Атака(Lateral Hit)" cost="13125" min_level="83"/>
			<skill id="30506" level="3" name="Удар Ногой в Голову с Разворота(Distant Kick)" cost="13125" min_level="83"/>
			<skill id="30501" level="16" name="Удар с Разворота(Backspin Blow)" cost="13125" min_level="83"/>
			<skill id="30508" level="16" name="Шаг Вправо(Right Sidestep)" cost="13125" min_level="83"/>
			<skill id="30504" level="5" name="Встречный Ветер Гравитации(Gravity Hit)" cost="14250" min_level="84"/>
			<skill id="30530" level="5" name="Искажение Энергии(Crushing Air)" cost="14250" min_level="84"/>
			<skill id="30502" level="14" name="Удар с Рассечением(Chin Strike)" cost="14250" min_level="84"/>
			<skill id="30507" level="14" name="Шаг Влево(Left Sidestep)" cost="14250" min_level="84"/>
		</class>
	</normal_skill_tree>
</list>